{
  "$schema": "./client-paths.schema.json",
  "skillId": "unity-open-mcp",
  "templateRelativePath": "skills/unity-open-mcp/SKILL.md",
  "description": "Single source of truth for project-relative agent-skill install paths and the MCP-client to skill-target mapping. Consumed by the Hub wizard (hub/src-tauri/src/config/mcp_config.rs), the bridge window configure panel, and unity_open_mcp_generate_skill (mcp-server/src/skill/generate-skill.ts). To add or rename a client, edit this file — do not hand-maintain duplicate constants in Rust or TypeScript.",
  "clients": {
    "cursor": { "relativePath": ".cursor/skills/unity-open-mcp/SKILL.md" },
    "claude": { "relativePath": ".claude/skills/unity-open-mcp/SKILL.md" },
    "opencode": { "relativePath": ".opencode/skills/unity-open-mcp/SKILL.md" },
    "agents": { "relativePath": ".agents/skills/unity-open-mcp/SKILL.md" },
    "cline": { "relativePath": ".cline/skills/unity-open-mcp/SKILL.md" },
    "gemini": { "relativePath": ".gemini/skills/unity-open-mcp/SKILL.md" },
    "kilocode": { "relativePath": ".kilocode/skills/unity-open-mcp/SKILL.md" },
    "roo": { "relativePath": ".roo/skills/unity-open-mcp/SKILL.md" },
    "agent": { "relativePath": ".agent/skills/unity-open-mcp/SKILL.md" },
    "junie": { "relativePath": ".junie/skills/unity-open-mcp/SKILL.md" },
    "github": { "relativePath": ".github/skills/unity-open-mcp/SKILL.md" }
  },
  "mcpClientMapping": {
    "cursor": ["cursor"],
    "cursor-project": ["cursor"],
    "claude-desktop": ["claude"],
    "claude-code": ["claude"],
    "opencode-global": ["opencode"],
    "opencode-project": ["opencode"],
    "zcode-global": ["agents"],
    "zcode-project": ["agents"],
    "zoocode": ["roo"],
    "cline": ["cline"],
    "codex": ["agents"],
    "gemini": ["gemini"],
    "github-copilot-cli": ["claude"],
    "kilo-code": ["kilocode"],
    "rider": ["junie"],
    "unity-ai": [],
    "vscode-copilot": ["github"],
    "vs-copilot": ["github"],
    "antigravity": ["agent"],
    "custom": ["cursor", "claude", "opencode", "agents"],
    "manual": ["cursor", "claude", "opencode", "agents"]
  }
}
